#,Title,Authors,Abstract,Announced,URL,DOI
80,"Right Place, Right Time! Dynamizing Topological Graphs for Embodied Navigation","Vishnu Sashank Dorbala,Bhrij Patel,Amrit Singh Bedi,Dinesh Manocha","Embodied Navigation tasks often involve constructing topological graphs of a scene during exploration to facilitate high-level planning and decision-making for execution in continuous environments. Prior literature makes the assumption of static graphs with stationary targets, which does not hold in many real-world environments with moving objects. To address this, we present a novel formulation generalizing navigation to dynamic environments by introducing structured object transitions to dynamize static topological graphs called Object Transition Graphs (OTGs). OTGs simulate portable targets following structured routes inspired by human habits. We apply this technique to Matterport3D (MP3D), a popular simulator for evaluating embodied tasks. On these dynamized OTGs, we establish a navigation benchmark by evaluating Oracle-based, Reinforcement Learning, and Large Language Model (LLM)-based approaches on a multi-object finding task. Further, we quantify agent adaptability, and make key inferences such as agents employing learned decision-making strategies generalize better than those relying on privileged oracle knowledge. To the best of our knowledge, ours is the first work to introduce structured temporal dynamism on topological graphs for studying generalist embodied navigation policies. The code and dataset for our OTGs will be made publicly available to foster research on embodied navigation in dynamic scenes.",March 2024.,https://arxiv.org/abs/2403.09905,
81,FunGraph: Functionality Aware 3D Scene Graphs for Language-Prompted Scene Interaction,"Dennis Rotondi,Fabio Scaparro,Hermann Blum,Kai O. Arras","The concept of 3D scene graphs is increasingly recognized as a powerful semantic and hierarchical representation of the environment. Current approaches often address this at a coarse, object-level resolution. In contrast, our goal is to develop a representation that enables robots to directly interact with their environment by identifying both the location of functional interactive elements and how these can be used. To achieve this, we focus on detecting and storing objects at a finer resolution, focusing on affordance-relevant parts. The primary challenge lies in the scarcity of data that extends beyond instance-level detection and the inherent difficulty of capturing detailed object features using robotic sensors. We leverage currently available 3D resources to generate 2D data and train a detector, which is then used to augment the standard 3D scene graph generation pipeline. Through our experiments, we demonstrate that our approach achieves functional element segmentation comparable to state-of-the-art 3D models and that our augmentation enables task-driven affordance grounding with higher accuracy than the current solutions.",March 2025.,https://arxiv.org/abs/2503.07909,
82,Lost & Found: Tracking Changes from Egocentric Observations in 3D Dynamic Scene Graphs,"Tjark Behrens,Ren\xc3\xa9 Zurbr\xc3\xbcgg,Marc Pollefeys,Zuria Bauer,Hermann Blum","Recent approaches have successfully focused on the segmentation of static reconstructions, thereby equipping downstream applications with semantic 3D understanding. However, the world in which we live is dynamic, characterized by numerous interactions between the environment and humans or robotic agents. Static semantic maps are unable to capture this information, and the naive solution of rescanning the environment after every change is both costly and ineffective in tracking e.g. objects being stored away in drawers. With Lost & Found we present an approach that addresses this limitation. Based solely on egocentric recordings with corresponding hand position and camera pose estimates, we are able to track the 6DoF poses of the moving object within the detected interaction interval. These changes are applied online to a transformable scene graph that captures object-level relations. Compared to state-of-the-art object pose trackers, our approach is more reliable in handling the challenging egocentric viewpoint and the lack of depth information. It outperforms the second-best approach by 34% and 56% for translational and orientational error, respectively, and produces visibly smoother 6DoF object trajectories. In addition, we illustrate how the acquired interaction information in the dynamic scene graph can be employed in the context of robotic applications that would otherwise be unfeasible: We show how our method allows to command a mobile manipulator through teach & repeat, and how information about prior interaction allows a mobile manipulator to retrieve an object hidden in a drawer. Code, videos and corresponding data are accessible at https://behretj.github.io/LostAndFound.",November 2024.,https://arxiv.org/abs/2411.19162,https://doi.org/10.1109/LRA.2025.3544518
83,Talk2PC: Enhancing 3D Visual Grounding through LiDAR and Radar Point Clouds Fusion for Autonomous Driving,"Runwei Guan,Jianan Liu,Ningwei Ouyang,Daizong Liu,Xiaolou Sun,Lianqing Zheng,Ming Xu,Yutao Yue,Hui Xiong","Embodied outdoor scene understanding forms the foundation for autonomous agents to perceive, analyze, and react to dynamic driving environments. However, existing 3D understanding is predominantly based on 2D Vision-Language Models (VLMs), collecting and processing limited scene-aware contexts. Instead, compared to the 2D planar visual information, point cloud sensors like LiDAR offer rich depth information and fine-grained 3D representations of objects. Meanwhile, the emerging 4D millimeter-wave (mmWave) radar is capable of detecting the motion trend, velocity, and reflection intensity of each object. Therefore, the integration of these two modalities provides more flexible querying conditions for natural language, enabling more accurate 3D visual grounding. To this end, in this paper, we exploratively propose a novel method called TPCNet, the first outdoor 3D visual grounding model upon the paradigm of prompt-guided point cloud sensor combination, including both LiDAR and radar contexts. To adaptively balance the features of these two sensors required by the prompt, we have designed a multi-fusion paradigm called Two-Stage Heterogeneous Modal Adaptive Fusion. Specifically, this paradigm initially employs Bidirectional Agent Cross-Attention (BACA), which feeds dual-sensor features, characterized by global receptive fields, to the text features for querying. Additionally, we have designed a Dynamic Gated Graph Fusion (DGGF) module to locate the regions of interest identified by the queries. To further enhance accuracy, we innovatively devise an C3D-RECHead, based on the nearest object edge. Our experiments have demonstrated that our TPCNet, along with its individual modules, achieves the state-of-the-art performance on both the Talk2Radar and Talk2Car datasets.",March 2025.,https://arxiv.org/abs/2503.08336,
84,Collaborative Dynamic 3D Scene Graphs for Open-Vocabulary Urban Scene Understanding,"Tim Steinke,Martin B\xc3\xbcchner,Niclas V\xc3\xb6disch,Abhinav Valada","Mapping and scene representation are fundamental to reliable planning and navigation in mobile robots. While purely geometric maps using voxel grids allow for general navigation, obtaining up-to-date spatial and semantically rich representations that scale to dynamic large-scale environments remains challenging. In this work, we present CURB-OSG, an open-vocabulary dynamic 3D scene graph engine that generates hierarchical decompositions of urban driving scenes via multi-agent collaboration. By fusing the camera and LiDAR observations from multiple perceiving agents with unknown initial poses, our approach generates more accurate maps compared to a single agent while constructing a unified open-vocabulary semantic hierarchy of the scene. Unlike previous methods that rely on ground truth agent poses or are evaluated purely in simulation, CURB-OSG alleviates these constraints. We evaluate the capabilities of CURB-OSG on real-world multi-agent sensor data obtained from multiple sessions of the Oxford Radar RobotCar dataset. We demonstrate improved mapping and object prediction accuracy through multi-agent collaboration as well as evaluate the environment partitioning capabilities of the proposed approach. To foster further research, we release our code and supplementary material at https://ov-curb.cs.uni-freiburg.de.",March 2025.,https://arxiv.org/abs/2503.08474,
85,GraphSCENE: On-Demand Critical Scenario Generation for Autonomous Vehicles in Simulation,"Efimia Panagiotaki,Georgi Pramatarov,Lars Kunze,Daniele De Martini","Testing and validating Autonomous Vehicle (AV) performance in safety-critical and diverse scenarios is crucial before real-world deployment. However, manually creating such scenarios in simulation remains a significant and time-consuming challenge. This work introduces a novel method that generates dynamic temporal scene graphs corresponding to diverse traffic scenarios, on-demand, tailored to user-defined preferences, such as AV actions, sets of dynamic agents, and criticality levels. A temporal Graph Neural Network (GNN) model learns to predict relationships between ego-vehicle, agents, and static structures, guided by real-world spatiotemporal interaction patterns and constrained by an ontology that restricts predictions to semantically valid links. Our model consistently outperforms the baselines in accurately generating links corresponding to the requested scenarios. We render the predicted scenarios in simulation to further demonstrate their effectiveness as testing environments for AV agents.",October 2024.,https://arxiv.org/abs/2410.13514,
86,Visual Attention Graph,"Kai-Fu Yang,Yong-Jie Li","Visual attention plays a critical role when our visual system executes active visual tasks by interacting with the physical scene. However, how to encode the visual object relationship in the psychological world of our brain deserves to be explored. In the field of computer vision, predicting visual fixations or scanpaths is a usual way to explore the visual attention and behaviors of human observers when viewing a scene. Most existing methods encode visual attention using individual fixations or scanpaths based on the raw gaze shift data collected from human observers. This may not capture the common attention pattern well, because without considering the semantic information of the viewed scene, raw gaze shift data alone contain high inter- and intra-observer variability. To address this issue, we propose a new attention representation, called Attention Graph, to simultaneously code the visual saliency and scanpath in a graph-based representation and better reveal the common attention behavior of human observers. In the attention graph, the semantic-based scanpath is defined by the path on the graph, while saliency of objects can be obtained by computing fixation density on each node. Systemic experiments demonstrate that the proposed attention graph combined with our new evaluation metrics provides a better benchmark for evaluating attention prediction methods. Meanwhile, extra experiments demonstrate the promising potentials of the proposed attention graph in assessing human cognitive states, such as autism spectrum disorder screening and age classification.",March 2025.,https://arxiv.org/abs/2503.08531,
87,Motion Blender Gaussian Splatting for Dynamic Reconstruction,"Xinyu Zhang,Haonan Chang,Yuhan Liu,Abdeslam Boularias","Gaussian splatting has emerged as a powerful tool for high-fidelity reconstruction of dynamic scenes. However, existing methods primarily rely on implicit motion representations, such as encoding motions into neural networks or per-Gaussian parameters, which makes it difficult to further manipulate the reconstructed motions. This lack of explicit controllability limits existing methods to replaying recorded motions only, which hinders a wider application. To address this, we propose Motion Blender Gaussian Splatting (MB-GS), a novel framework that uses motion graph as an explicit and sparse motion representation. The motion of graph links is propagated to individual Gaussians via dual quaternion skinning, with learnable weight painting functions determining the influence of each link. The motion graphs and 3D Gaussians are jointly optimized from input videos via differentiable rendering. Experiments show that MB-GS achieves state-of-the-art performance on the iPhone dataset while being competitive on HyperNeRF. Additionally, we demonstrate the application potential of our method in generating novel object motions and robot demonstrations through motion editing. Video demonstrations can be found at https://mlzxy.github.io/mbgs.",March 2025.,https://arxiv.org/abs/2503.09040,
88,Long-Term Planning Around Humans in Domestic Environments with 3D Scene Graphs,"Ermanno Bartoli,Dennis Rotondi,Kai O. Arras,Iolanda Leite","Long-term planning for robots operating in domestic environments poses unique challenges due to the interactions between humans, objects, and spaces. Recent advancements in trajectory planning have leveraged vision-language models (VLMs) to extract contextual information for robots operating in real-world environments. While these methods achieve satisfying performance, they do not explicitly model human activities. Such activities influence surrounding objects and reshape spatial constraints. This paper presents a novel approach to trajectory planning that integrates human preferences, activities, and spatial context through an enriched 3D scene graph (3DSG) representation. By incorporating activity-based relationships, our method captures the spatial impact of human actions, leading to more context-sensitive trajectory adaptation. Preliminary results demonstrate that our approach effectively assigns costs to spaces influenced by human activities, ensuring that the robot trajectory remains contextually appropriate and sensitive to the ongoing environment. This balance between task efficiency and social appropriateness enhances context-aware human-robot interactions in domestic settings. Future work includes implementing a full planning pipeline and conducting user studies to evaluate trajectory acceptability.",March 2025.,https://arxiv.org/abs/2503.09173,
89,Speedy MASt3R,"Jingxing Li,Yongjae Lee,Abhay Kumar Yadav,Cheng Peng,Rama Chellappa,Deliang Fan","Image matching is a key component of modern 3D vision algorithms, essential for accurate scene reconstruction and localization. MASt3R redefines image matching as a 3D task by leveraging DUSt3R and introducing a fast reciprocal matching scheme that accelerates matching by orders of magnitude while preserving theoretical guarantees. This approach has gained strong traction, with DUSt3R and MASt3R collectively cited over 250 times in a short span, underscoring their impact. However, despite its accuracy, MASt3R's inference speed remains a bottleneck. On an A40 GPU, latency per image pair is 198.16 ms, mainly due to computational overhead from the ViT encoder-decoder and Fast Reciprocal Nearest Neighbor (FastNN) matching.  To address this, we introduce Speedy MASt3R, a post-training optimization framework that enhances inference efficiency while maintaining accuracy. It integrates multiple optimization techniques, including FlashMatch-an approach leveraging FlashAttention v2 with tiling strategies for improved efficiency, computation graph optimization via layer and tensor fusion having kernel auto-tuning with TensorRT (GraphFusion), and a streamlined FastNN pipeline that reduces memory access time from quadratic to linear while accelerating block-wise correlation scoring through vectorized computation (FastNN-Lite). Additionally, it employs mixed-precision inference with FP16/FP32 hybrid computations (HybridCast), achieving speedup while preserving numerical precision. Evaluated on Aachen Day-Night, InLoc, 7-Scenes, ScanNet1500, and MegaDepth1500, Speedy MASt3R achieves a 54% reduction in inference time (198 ms to 91 ms per image pair) without sacrificing accuracy. This advancement enables real-time 3D understanding, benefiting applications like mixed reality navigation and large-scale 3D scene reconstruction.",March 2025.,https://arxiv.org/abs/2503.10017,
90,OSMa-Bench: Evaluating Open Semantic Mapping Under Varying Lighting Conditions,"Maxim Popov,Regina Kurkova,Mikhail Iumanov,Jaafar Mahmoud,Sergey Kolyubin","Open Semantic Mapping (OSM) is a key technology in robotic perception, combining semantic segmentation and SLAM techniques. This paper introduces a dynamically configurable and highly automated LLM/LVLM-powered pipeline for evaluating OSM solutions called OSMa-Bench (Open Semantic Mapping Benchmark). The study focuses on evaluating state-of-the-art semantic mapping algorithms under varying indoor lighting conditions, a critical challenge in indoor environments. We introduce a novel dataset with simulated RGB-D sequences and ground truth 3D reconstructions, facilitating the rigorous analysis of mapping performance across different lighting conditions. Through experiments on leading models such as ConceptGraphs, BBQ and OpenScene, we evaluate the semantic fidelity of object recognition and segmentation. Additionally, we introduce a Scene Graph evaluation method to analyze the ability of models to interpret semantic structure. The results provide insights into the robustness of these models, forming future research directions for developing resilient and adaptable robotic systems. Our code is available at https://be2rlab.github.io/OSMa-Bench/.",March 2025.,https://arxiv.org/abs/2503.10331,
91,Graph-Grounded LLMs: Leveraging Graphical Function Calling to Minimize LLM Hallucinations,"Piyush Gupta,Sangjae Bae,David Isele","The adoption of Large Language Models (LLMs) is rapidly expanding across various tasks that involve inherent graphical structures. Graphs are integral to a wide range of applications, including motion planning for autonomous vehicles, social networks, scene understanding, and knowledge graphs. Many problems, even those not initially perceived as graph-based, can be effectively addressed through graph theory. However, when applied to these tasks, LLMs often encounter challenges, such as hallucinations and mathematical inaccuracies. To overcome these limitations, we propose Graph-Grounded LLMs, a system that improves LLM performance on graph-related tasks by integrating a graph library through function calls. By grounding LLMs in this manner, we demonstrate significant reductions in hallucinations and improved mathematical accuracy in solving graph-based problems, as evidenced by the performance on the NLGraph benchmark. Finally, we showcase a disaster rescue application where the Graph-Grounded LLM acts as a decision-support system.",March 2025.,https://arxiv.org/abs/2503.10941,
92,Image-Goal Navigation Using Refined Feature Guidance and Scene Graph Enhancement,"Zhicheng Feng,Xieyuanli Chen,Chenghao Shi,Lun Luo,Zhichao Chen,Yun-Hui Liu,Huimin Lu","In this paper, we introduce a novel image-goal navigation approach, named RFSG. Our focus lies in leveraging the fine-grained connections between goals, observations, and the environment within limited image data, all the while keeping the navigation architecture simple and lightweight. To this end, we propose the spatial-channel attention mechanism, enabling the network to learn the importance of multi-dimensional features to fuse the goal and observation features. In addition, a selfdistillation mechanism is incorporated to further enhance the feature representation capabilities. Given that the navigation task needs surrounding environmental information for more efficient navigation, we propose an image scene graph to establish feature associations at both the image and object levels, effectively encoding the surrounding scene information. Crossscene performance validation was conducted on the Gibson and HM3D datasets, and the proposed method achieved stateof-the-art results among mainstream methods, with a speed of up to 53.5 frames per second on an RTX3080. This contributes to the realization of end-to-end image-goal navigation in realworld scenarios. The implementation and model of our method have been released at: https://github.com/nubot-nudt/RFSG.",March 2025.,https://arxiv.org/abs/2503.10986,
93,MR-COGraphs: Communication-efficient Multi-Robot Open-vocabulary Mapping System via 3D Scene Graphs,"Qiuyi Gu,Zhaocheng Ye,Jincheng Yu,Jiahao Tang,Tinghao Yi,Yuhan Dong,Jian Wang,Jinqiang Cui,Xinlei Chen,Yu Wang","Collaborative perception in unknown environments is crucial for multi-robot systems. With the emergence of foundation models, robots can now not only perceive geometric information but also achieve open-vocabulary scene understanding. However, existing map representations that support open-vocabulary queries often involve large data volumes, which becomes a bottleneck for multi-robot transmission in communication-limited environments. To address this challenge, we develop a method to construct a graph-structured 3D representation called COGraph, where nodes represent objects with semantic features and edges capture their spatial adjacency relationships. Before transmission, a data-driven feature encoder is applied to compress the feature dimensions of the COGraph. Upon receiving COGraphs from other robots, the semantic features of each node are recovered using a decoder. We also propose a feature-based approach for place recognition and translation estimation, enabling the merging of local COGraphs into a unified global map. We validate our framework on two realistic datasets and the real-world environment. The results demonstrate that, compared to existing baselines for open-vocabulary map construction, our framework reduces the data volume by over 80\\% while maintaining mapping and query performance without compromise. For more details, please visit our website at https://github.com/efc-robot/MR-COGraphs.",December 2024.,https://arxiv.org/abs/2412.18381,
94,EmbodiedVSR: Dynamic Scene Graph-Guided Chain-of-Thought Reasoning for Visual Spatial Tasks,"Yi Zhang,Qiang Zhang,Xiaozhu Ju,Zhaoyang Liu,Jilei Mao,Jingkai Sun,Jintao Wu,Shixiong Gao,Shihan Cai,Zhiyuan Qin,Linkai Liang,Jiaxu Wang,Yiqun Duan,Jiahang Cao,Renjing Xu,Jian Tang","While multimodal large language models (MLLMs) have made groundbreaking progress in embodied intelligence, they still face significant challenges in spatial reasoning for complex long-horizon tasks. To address this gap, we propose EmbodiedVSR (Embodied Visual Spatial Reasoning), a novel framework that integrates dynamic scene graph-guided Chain-of-Thought (CoT) reasoning to enhance spatial understanding for embodied agents. By explicitly constructing structured knowledge representations through dynamic scene graphs, our method enables zero-shot spatial reasoning without task-specific fine-tuning. This approach not only disentangles intricate spatial relationships but also aligns reasoning steps with actionable environmental dynamics. To rigorously evaluate performance, we introduce the eSpatial-Benchmark, a comprehensive dataset including real-world embodied scenarios with fine-grained spatial annotations and adaptive task difficulty levels. Experiments demonstrate that our framework significantly outperforms existing MLLM-based methods in accuracy and reasoning coherence, particularly in long-horizon tasks requiring iterative environment interaction. The results reveal the untapped potential of MLLMs for embodied intelligence when equipped with structured, explainable reasoning mechanisms, paving the way for more reliable deployment in real-world spatial applications. The codes and datasets will be released soon.",March 2025.,https://arxiv.org/abs/2503.11089,
95,Vipera: Towards systematic auditing of generative text-to-image models at scale,"Yanwei Huang,Wesley Hanwen Deng,Sijia Xiao,Motahhare Eslami,Jason I. Hong,Adam Perer","Generative text-to-image (T2I) models are known for their risks related such as bias, offense, and misinformation. Current AI auditing methods face challenges in scalability and thoroughness, and it is even more challenging to enable auditors to explore the auditing space in a structural and effective way. Vipera employs multiple visual cues including a scene graph to facilitate image collection sensemaking and inspire auditors to explore and hierarchically organize the auditing criteria. Additionally, it leverages LLM-powered suggestions to facilitate exploration of unexplored auditing directions. An observational user study demonstrates Vipera's effectiveness in helping auditors organize their analyses while engaging with diverse criteria.",March 2025.,https://arxiv.org/abs/2503.11113,https://doi.org/10.1145/3706599.3719757
