#,Title,Authors,Abstract,Announced,URL,DOI
33,Improving Generalization Ability for 3D Object Detection by Learning Sparsity-invariant Features,"Hsin-Cheng Lu,Chung-Yi Lin,Winston H. Hsu","In autonomous driving, 3D object detection is essential for accurately identifying and tracking objects. Despite the continuous development of various technologies for this task, a significant drawback is observed in most of them-they experience substantial performance degradation when detecting objects in unseen domains. In this paper, we propose a method to improve the generalization ability for 3D object detection on a single domain. We primarily focus on generalizing from a single source domain to target domains with distinct sensor configurations and scene distributions. To learn sparsity-invariant features from a single source domain, we selectively subsample the source data to a specific beam, using confidence scores determined by the current detector to identify the density that holds utmost importance for the detector. Subsequently, we employ the teacher-student framework to align the Bird's Eye View (BEV) features for different point clouds densities. We also utilize feature content alignment (FCA) and graph-based embedding relationship alignment (GERA) to instruct the detector to be domain-agnostic. Extensive experiments demonstrate that our method exhibits superior generalization capabilities compared to other baselines. Furthermore, our approach even outperforms certain domain adaptation methods that can access to the target domain data.",February 2025.,https://arxiv.org/abs/2502.02322,
34,Functional 3D Scene Synthesis through Human-Scene Optimization,"Yao Wei,Matteo Toso,Pietro Morerio,Michael Ying Yang,Alessio Del Bue","This paper presents a novel generative approach that outputs 3D indoor environments solely from a textual description of the scene. Current methods often treat scene synthesis as a mere layout prediction task, leading to rooms with overlapping objects or overly structured scenes, with limited consideration of the practical usability of the generated environment. Instead, our approach is based on a simple, but effective principle: we condition scene synthesis to generate rooms that are usable by humans. This principle is implemented by synthesizing 3D humans that interact with the objects composing the scene. If this human-centric scene generation is viable, the room layout is functional and it leads to a more coherent 3D structure. To this end, we propose a novel method for functional 3D scene synthesis, which consists of reasoning, 3D assembling and optimization. We regard text guided 3D synthesis as a reasoning process by generating a scene graph via a graph diffusion network. Considering object functional co-occurrence, a new strategy is designed to better accommodate human-object interaction and avoidance, achieving human-aware 3D scene optimization. We conduct both qualitative and quantitative experiments to validate the effectiveness of our method in generating coherent 3D scene synthesis results.",February 2025.,https://arxiv.org/abs/2502.06819,
35,Mapping and Localization Using LiDAR Fiducial Markers,Yibo Liu,"LiDAR sensors are essential for autonomous systems, yet LiDAR fiducial markers (LFMs) lag behind visual fiducial markers (VFMs) in adoption and utility. Bridging this gap is vital for robotics and computer vision but challenging due to the sparse, unstructured nature of 3D LiDAR data and 2D-focused fiducial marker designs. This dissertation proposes a novel framework for mapping and localization using LFMs is proposed to benefit a variety of real-world applications, including the collection of 3D assets and training data for point cloud registration, 3D map merging, Augmented Reality (AR), and many more.  First, an Intensity Image-based LiDAR Fiducial Marker (IFM) system is introduced, using thin, letter-sized markers compatible with VFMs. A detection method locates 3D fiducials from intensity images, enabling LiDAR pose estimation. Second, an enhanced algorithm extends detection to 3D maps, increasing marker range and facilitating tasks like 3D map merging. This method leverages both intensity and geometry, overcoming limitations of geometry-only detection approaches. Third, a new LFM-based mapping and localization method registers unordered, low-overlap point clouds. It employs adaptive threshold detection and a two-level graph framework to solve a maximum a-posteriori (MAP) problem, optimizing point cloud and marker poses. Additionally, the Livox-3DMatch dataset is introduced, improving learning-based multiview point cloud registration methods.  Extensive experiments with various LiDAR models in diverse indoor and outdoor scenes demonstrate the effectiveness and superiority of the proposed framework.",February 2025.,https://arxiv.org/abs/2502.03510,
36,A Schema-Guided Reason-while-Retrieve framework for Reasoning on Scene Graphs with Large-Language-Models (LLMs),"Yiye Chen,Harpreet Sawhney,Nicholas Gyd\xc3\xa9,Yanan Jian,Jack Saunders,Patricio Vela,Ben Lundell","Scene graphs have emerged as a structured and serializable environment representation for grounded spatial reasoning with Large Language Models (LLMs). In this work, we propose SG-RwR, a Schema-Guided Retrieve-while-Reason framework for reasoning and planning with scene graphs. Our approach employs two cooperative, code-writing LLM agents: a (1) Reasoner for task planning and information queries generation, and a (2) Retriever for extracting corresponding graph information following the queries. Two agents collaborate iteratively, enabling sequential reasoning and adaptive attention to graph information. Unlike prior works, both agents are prompted only with the scene graph schema rather than the full graph data, which reduces the hallucination by limiting input tokens, and drives the Reasoner to generate reasoning trace abstractly.Following the trace, the Retriever programmatically query the scene graph data based on the schema understanding, allowing dynamic and global attention on the graph that enhances alignment between reasoning and retrieval. Through experiments in multiple simulation environments, we show that our framework surpasses existing LLM-based approaches in numerical Q\\&A and planning tasks, and can benefit from task-level few-shot examples, even in the absence of agent-level demonstrations. Project code will be released.",February 2025.,https://arxiv.org/abs/2502.03450,
37,CoKnowledge: Supporting Assimilation of Time-synced Collective Knowledge in Online Science Videos,"Yuanhao Zhang,Yumeng Wang,Xiyuan Wang,Changyang He,Chenliang Huang,Xiaojuan Ma","Danmaku, a system of scene-aligned, time-synced, floating comments, can augment video content to create 'collective knowledge'. However, its chaotic nature often hinders viewers from effectively assimilating the collective knowledge, especially in knowledge-intensive science videos. With a formative study, we examined viewers' practices for processing collective knowledge and the specific barriers they encountered. Building on these insights, we designed a processing pipeline to filter, classify, and cluster danmaku, leading to the development of CoKnowledge - a tool incorporating a video abstract, knowledge graphs, and supplementary danmaku features to support viewers' assimilation of collective knowledge in science videos. A within-subject study (N=24) showed that CoKnowledge significantly enhanced participants' comprehension and recall of collective knowledge compared to a baseline with unprocessed live comments. Based on our analysis of user interaction patterns and feedback on design features, we presented design considerations for developing similar support tools.",February 2025.,https://arxiv.org/abs/2502.03767,
38,Taking A Closer Look at Interacting Objects: Interaction-Aware Open Vocabulary Scene Graph Generation,"Lin Li,Chuhan Zhang,Dong Zhang,Chong Sun,Chen Li,Long Chen","Today's open vocabulary scene graph generation (OVSGG) extends traditional SGG by recognizing novel objects and relationships beyond predefined categories, leveraging the knowledge from pre-trained large-scale models. Most existing methods adopt a two-stage pipeline: weakly supervised pre-training with image captions and supervised fine-tuning (SFT) on fully annotated scene graphs. Nonetheless, they omit explicit modeling of interacting objects and treat all objects equally, resulting in mismatched relation pairs. To this end, we propose an interaction-aware OVSGG framework INOVA. During pre-training, INOVA employs an interaction-aware target generation strategy to distinguish interacting objects from non-interacting ones. In SFT, INOVA devises an interaction-guided query selection tactic to prioritize interacting objects during bipartite graph matching. Besides, INOVA is equipped with an interaction-consistent knowledge distillation to enhance the robustness by pushing interacting object pairs away from the background. Extensive experiments on two benchmarks (VG and GQA) show that INOVA achieves state-of-the-art performance, demonstrating the potential of interaction-aware mechanisms for real-world applications.",February 2025.,https://arxiv.org/abs/2502.03856,
39,Talk2Radar: Bridging Natural Language with 4D mmWave Radar for 3D Referring Expression Comprehension,"Runwei Guan,Ruixiao Zhang,Ningwei Ouyang,Jianan Liu,Ka Lok Man,Xiaohao Cai,Ming Xu,Jeremy Smith,Eng Gee Lim,Yutao Yue,Hui Xiong","Embodied perception is essential for intelligent vehicles and robots in interactive environmental understanding. However, these advancements primarily focus on vision, with limited attention given to using 3D modeling sensors, restricting a comprehensive understanding of objects in response to prompts containing qualitative and quantitative queries. Recently, as a promising automotive sensor with affordable cost, 4D millimeter-wave radars provide denser point clouds than conventional radars and perceive both semantic and physical characteristics of objects, thereby enhancing the reliability of perception systems. To foster the development of natural language-driven context understanding in radar scenes for 3D visual grounding, we construct the first dataset, Talk2Radar, which bridges these two modalities for 3D Referring Expression Comprehension (REC). Talk2Radar contains 8,682 referring prompt samples with 20,558 referred objects. Moreover, we propose a novel model, T-RadarNet, for 3D REC on point clouds, achieving State-Of-The-Art (SOTA) performance on the Talk2Radar dataset compared to counterparts. Deformable-FPN and Gated Graph Fusion are meticulously designed for efficient point cloud feature modeling and cross-modal fusion between radar and text features, respectively. Comprehensive experiments provide deep insights into radar-based 3D REC. We release our project at https://github.com/GuanRunwei/Talk2Radar.",May 2024.,https://arxiv.org/abs/2405.12821,
40,SurGrID: Controllable Surgical Simulation via Scene Graph to Image Diffusion,"Yannik Frisch,Ssharvien Kumar Sivakumar,\xc3\x87a\xc4\x9fhan K\xc3\xb6ksal,Elsa B\xc3\xb6hm,Felix Wagner,Adrian Gericke,Ghazal Ghazaei,Anirban Mukhopadhyay","Surgical simulation offers a promising addition to conventional surgical training. However, available simulation tools lack photorealism and rely on hardcoded behaviour. Denoising Diffusion Models are a promising alternative for high-fidelity image synthesis, but existing state-of-the-art conditioning methods fall short in providing precise control or interactivity over the generated scenes.  We introduce SurGrID, a Scene Graph to Image Diffusion Model, allowing for controllable surgical scene synthesis by leveraging Scene Graphs. These graphs encode a surgical scene's components' spatial and semantic information, which are then translated into an intermediate representation using our novel pre-training step that explicitly captures local and global information.  Our proposed method improves the fidelity of generated images and their coherence with the graph input over the state-of-the-art. Further, we demonstrate the simulation's realism and controllability in a user assessment study involving clinical experts.  Scene Graphs can be effectively used for precise and interactive conditioning of Denoising Diffusion Models for simulating surgical scenes, enabling high fidelity and interactive control over the generated content.",February 2025.,https://arxiv.org/abs/2502.07945,
41,Embed Any NeRF: Graph Meta-Networks for Neural Tasks on Arbitrary NeRF Architectures,"Francesco Ballerini,Pierluigi Zama Ramirez,Samuele Salti,Luigi Di Stefano","Neural Radiance Fields (NeRFs) have emerged as a groundbreaking paradigm for representing 3D objects and scenes by encoding shape and appearance information into the weights of a neural network. Recent works have shown how such weights can be used as input to frameworks processing them to solve deep learning tasks. Yet, these frameworks can only process NeRFs with a specific, predefined architecture. In this paper, we present the first framework that can ingest NeRFs with multiple architectures and perform inference on architectures unseen at training time. We achieve this goal by training a Graph Meta-Network in a representation learning framework. Moreover, we show how a contrastive objective is conducive to obtaining an architecture-agnostic latent space. In experiments on both MLP-based and tri-planar NeRFs, our approach demonstrates robust performance in classification and retrieval tasks that either matches or exceeds that of existing frameworks constrained to single architectures, thus providing the first architecture-agnostic method to perform tasks on NeRFs by processing their weights.",February 2025.,https://arxiv.org/abs/2502.09623,
42,DynoSAM: Open-Source Smoothing and Mapping Framework for Dynamic SLAM,"Jesse Morris,Yiduo Wang,Mikolaj Kliniewski,Viorela Ila","Traditional Visual Simultaneous Localization and Mapping (vSLAM) systems focus solely on static scene structures, overlooking dynamic elements in the environment. Although effective for accurate visual odometry in complex scenarios, these methods discard crucial information about moving objects. By incorporating this information into a Dynamic SLAM framework, the motion of dynamic entities can be estimated, enhancing navigation whilst ensuring accurate localization. However, the fundamental formulation of Dynamic SLAM remains an open challenge, with no consensus on the optimal approach for accurate motion estimation within a SLAM pipeline. Therefore, we developed DynoSAM, an open-source framework for Dynamic SLAM that enables the efficient implementation, testing, and comparison of various Dynamic SLAM optimization formulations. DynoSAM integrates static and dynamic measurements into a unified optimization problem solved using factor graphs, simultaneously estimating camera poses, static scene, object motion or poses, and object structures. We evaluate DynoSAM across diverse simulated and real-world datasets, achieving state-of-the-art motion estimation in indoor and outdoor environments, with substantial improvements over existing systems. Additionally, we demonstrate DynoSAM utility in downstream applications, including 3D reconstruction of dynamic scenes and trajectory prediction, thereby showcasing potential for advancing dynamic object-aware SLAM systems. DynoSAM is open-sourced at https://github.com/ACFR-RPG/DynOSAM.",January 2025.,https://arxiv.org/abs/2501.11893,
43,SAM-LAD: Segment Anything Model Meets Zero-Shot Logic Anomaly Detection,"Yun Peng,Xiao Lin,Nachuan Ma,Jiayuan Du,Chuangwei Liu,Chengju Liu,Qijun Chen","Visual anomaly detection is vital in real-world applications, such as industrial defect detection and medical diagnosis. However, most existing methods focus on local structural anomalies and fail to detect higher-level functional anomalies under logical conditions. Although recent studies have explored logical anomaly detection, they can only address simple anomalies like missing or addition and show poor generalizability due to being heavily data-driven. To fill this gap, we propose SAM-LAD, a zero-shot, plug-and-play framework for logical anomaly detection in any scene. First, we obtain a query image's feature map using a pre-trained backbone. Simultaneously, we retrieve the reference images and their corresponding feature maps via the nearest neighbor search of the query image. Then, we introduce the Segment Anything Model (SAM) to obtain object masks of the query and reference images. Each object mask is multiplied with the entire image's feature map to obtain object feature maps. Next, an Object Matching Model (OMM) is proposed to match objects in the query and reference images. To facilitate object matching, we further propose a Dynamic Channel Graph Attention (DCGA) module, treating each object as a keypoint and converting its feature maps into feature vectors. Finally, based on the object matching relations, an Anomaly Measurement Model (AMM) is proposed to detect objects with logical anomalies. Structural anomalies in the objects can also be detected. We validate our proposed SAM-LAD using various benchmarks, including industrial datasets (MVTec Loco AD, MVTec AD), and the logical dataset (DigitAnatomy). Extensive experimental results demonstrate that SAM-LAD outperforms existing SoTA methods, particularly in detecting logical anomalies.",June 2024.,https://arxiv.org/abs/2406.00625,
44,CAST: Component-Aligned 3D Scene Reconstruction from an RGB Image,"Kaixin Yao,Longwen Zhang,Xinhao Yan,Yan Zeng,Qixuan Zhang,Lan Xu,Wei Yang,Jiayuan Gu,Jingyi Yu","Recovering high-quality 3D scenes from a single RGB image is a challenging task in computer graphics. Current methods often struggle with domain-specific limitations or low-quality object generation. To address these, we propose CAST (Component-Aligned 3D Scene Reconstruction from a Single RGB Image), a novel method for 3D scene reconstruction and recovery. CAST starts by extracting object-level 2D segmentation and relative depth information from the input image, followed by using a GPT-based model to analyze inter-object spatial relationships. This enables the understanding of how objects relate to each other within the scene, ensuring more coherent reconstruction. CAST then employs an occlusion-aware large-scale 3D generation model to independently generate each object's full geometry, using MAE and point cloud conditioning to mitigate the effects of occlusions and partial object information, ensuring accurate alignment with the source image's geometry and texture. To align each object with the scene, the alignment generation model computes the necessary transformations, allowing the generated meshes to be accurately placed and integrated into the scene's point cloud. Finally, CAST incorporates a physics-aware correction step that leverages a fine-grained relation graph to generate a constraint graph. This graph guides the optimization of object poses, ensuring physical consistency and spatial coherence. By utilizing Signed Distance Fields (SDF), the model effectively addresses issues such as occlusions, object penetration, and floating objects, ensuring that the generated scene accurately reflects real-world physical interactions. CAST can be leveraged in robotics, enabling efficient real-to-simulation workflows and providing realistic, scalable simulation environments for robotic systems.",February 2025.,https://arxiv.org/abs/2502.12894,
45,Physical Depth-aware Early Accident Anticipation: A Multi-dimensional Visual Feature Fusion Framework,"Hongpu Huang,Wei Zhou,Chen Wang","Early accident anticipation from dashcam videos is a highly desirable yet challenging task for improving the safety of intelligent vehicles. Existing advanced accident anticipation approaches commonly model the interaction among traffic agents (e.g., vehicles, pedestrians, etc.) in the coarse 2D image space, which may not adequately capture their true positions and interactions. To address this limitation, we propose a physical depth-aware learning framework that incorporates the monocular depth features generated by a large model named Depth-Anything to introduce more fine-grained spatial 3D information. Furthermore, the proposed framework also integrates visual interaction features and visual dynamic features from traffic scenes to provide a more comprehensive perception towards the scenes. Based on these multi-dimensional visual features, the framework captures early indicators of accidents through the analysis of interaction relationships between objects in sequential frames. Additionally, the proposed framework introduces a reconstruction adjacency matrix for key traffic participants that are occluded, mitigating the impact of occluded objects on graph learning and maintaining the spatio-temporal continuity. Experimental results on public datasets show that the proposed framework attains state-of-the-art performance, highlighting the effectiveness of incorporating visual depth features and the superiority of the proposed framework.",February 2025.,https://arxiv.org/abs/2502.18496,
46,Object-centric Binding in Contrastive Language-Image Pretraining,"Rim Assouel,Pietro Astolfi,Florian Bordes,Michal Drozdzal,Adriana Romero-Soriano","Recent advances in vision language models (VLM) have been driven by contrastive models such as CLIP, which learn to associate visual information with their corresponding text descriptions. However, these models have limitations in understanding complex compositional scenes involving multiple objects and their spatial relationships. To address these challenges, we propose a novel approach that diverges from commonly used strategies, which rely on the design of hard-negative augmentations. Instead, our work focuses on integrating inductive biases into pre-trained CLIP-like models to improve their compositional understanding without using any additional hard-negatives. To that end, we introduce a binding module that connects a scene graph, derived from a text description, with a slot-structured image representation, facilitating a structured similarity assessment between the two modalities. We also leverage relationships as text-conditioned visual constraints, thereby capturing the intricate interactions between objects and their contextual relationships more effectively. Our resulting model not only enhances the performance of CLIP-based models in multi-object compositional understanding but also paves the way towards more accurate and sample-efficient image-text matching of complex scenes.",February 2025.,https://arxiv.org/abs/2502.14113,
47,Weakly Supervised Video Scene Graph Generation via Natural Language Supervision,"Kibum Kim,Kanghoon Yoon,Yeonjun In,Jaehyeong Jeon,Jinyoung Moon,Donghyun Kim,Chanyoung Park","Existing Video Scene Graph Generation (VidSGG) studies are trained in a fully supervised manner, which requires all frames in a video to be annotated, thereby incurring high annotation cost compared to Image Scene Graph Generation (ImgSGG). Although the annotation cost of VidSGG can be alleviated by adopting a weakly supervised approach commonly used for ImgSGG (WS-ImgSGG) that uses image captions, there are two key reasons that hinder such a naive adoption: 1) Temporality within video captions, i.e., unlike image captions, video captions include temporal markers (e.g., before, while, then, after) that indicate time related details, and 2) Variability in action duration, i.e., unlike human actions in image captions, human actions in video captions unfold over varying duration. To address these issues, we propose a Natural Language-based Video Scene Graph Generation (NL-VSGG) framework that only utilizes the readily available video captions for training a VidSGG model. NL-VSGG consists of two key modules: Temporality-aware Caption Segmentation (TCS) module and Action Duration Variability-aware caption-frame alignment (ADV) module. Specifically, TCS segments the video captions into multiple sentences in a temporal order based on a Large Language Model (LLM), and ADV aligns each segmented sentence with appropriate frames considering the variability in action duration. Our approach leads to a significant enhancement in performance compared to simply applying the WS-ImgSGG pipeline to VidSGG on the Action Genome dataset. As a further benefit of utilizing the video captions as weak supervision, we show that the VidSGG model trained by NL-VSGG is able to predict a broader range of action classes that are not included in the training data, which makes our framework practical in reality.",February 2025.,https://arxiv.org/abs/2502.15370,
