#,Title,Authors,Abstract,Announced,URL,DOI
128,SG-Tailor: Inter-Object Commonsense Relationship Reasoning for Scene Graph Manipulation,"Haoliang Shang,Hanyu Wu,Guangyao Zhai,Boyang Sun,Fangjinhua Wang,Federico Tombari,Marc Pollefeys","Scene graphs capture complex relationships among objects, serving as strong priors for content generation and manipulation. Yet, reasonably manipulating scene graphs -- whether by adding nodes or modifying edges -- remains a challenging and untouched task. Tasks such as adding a node to the graph or reasoning about a node's relationships with all others are computationally intractable, as even a single edge modification can trigger conflicts due to the intricate interdependencies within the graph. To address these challenges, we introduce SG-Tailor, an autoregressive model that predicts the conflict-free relationship between any two nodes. SG-Tailor not only infers inter-object relationships, including generating commonsense edges for newly added nodes but also resolves conflicts arising from edge modifications to produce coherent, manipulated graphs for downstream tasks. For node addition, the model queries the target node and other nodes from the graph to predict the appropriate relationships. For edge modification, SG-Tailor employs a Cut-And-Stitch strategy to solve the conflicts and globally adjust the graph. Extensive experiments demonstrate that SG-Tailor outperforms competing methods by a large margin and can be seamlessly integrated as a plug-in module for scene generation and robotic manipulation tasks.",March 2025.,https://arxiv.org/abs/2503.18988,
129,PanoGS: Gaussian-based Panoptic Segmentation for 3D Open Vocabulary Scene Understanding,"Hongjia Zhai,Hai Li,Zhenzhe Li,Xiaokun Pan,Yijia He,Guofeng Zhang","Recently, 3D Gaussian Splatting (3DGS) has shown encouraging performance for open vocabulary scene understanding tasks. However, previous methods cannot distinguish 3D instance-level information, which usually predicts a heatmap between the scene feature and text query. In this paper, we propose PanoGS, a novel and effective 3D panoptic open vocabulary scene understanding approach. Technically, to learn accurate 3D language features that can scale to large indoor scenarios, we adopt the pyramid tri-plane to model the latent continuous parametric feature space and use a 3D feature decoder to regress the multi-view fused 2D feature cloud. Besides, we propose language-guided graph cuts that synergistically leverage reconstructed geometry and learned language cues to group 3D Gaussian primitives into a set of super-primitives. To obtain 3D consistent instance, we perform graph clustering based segmentation with SAM-guided edge affinity computation between different super-primitives. Extensive experiments on widely used datasets show better or more competitive performance on 3D panoptic open vocabulary scene understanding. Project page: \\href{https://zju3dv.github.io/panogs}{https://zju3dv.github.io/panogs}.",March 2025.,https://arxiv.org/abs/2503.18107,
130,Deep Polycuboid Fitting for Compact 3D Representation of Indoor Scenes,"Gahye Lee,Hyejeong Yoon,Jungeon Kim,Seungyong Lee","This paper presents a novel framework for compactly representing a 3D indoor scene using a set of polycuboids through a deep learning-based fitting method. Indoor scenes mainly consist of man-made objects, such as furniture, which often exhibit rectilinear geometry. This property allows indoor scenes to be represented using combinations of polycuboids, providing a compact representation that benefits downstream applications like furniture rearrangement. Our framework takes a noisy point cloud as input and first detects six types of cuboid faces using a transformer network. Then, a graph neural network is used to validate the spatial relationships of the detected faces to form potential polycuboids. Finally, each polycuboid instance is reconstructed by forming a set of boxes based on the aggregated face labels. To train our networks, we introduce a synthetic dataset encompassing a diverse range of cuboid and polycuboid shapes that reflect the characteristics of indoor scenes. Our framework generalizes well to real-world indoor scene datasets, including Replica, ScanNet, and scenes captured with an iPhone. The versatility of our method is demonstrated through practical applications, such as virtual room tours and scene editing.",March 2025.,https://arxiv.org/abs/2503.14912,
131,OCRT: Boosting Foundation Models in the Open World with Object-Concept-Relation Triad,"Luyao Tang,Yuxuan Yuan,Chaoqi Chen,Zeyu Zhang,Yue Huang,Kun Zhang","Although foundation models (FMs) claim to be powerful, their generalization ability significantly decreases when faced with distribution shifts, weak supervision, or malicious attacks in the open world. On the other hand, most domain generalization or adversarial fine-tuning methods are task-related or model-specific, ignoring the universality in practical applications and the transferability between FMs. This paper delves into the problem of generalizing FMs to the out-of-domain data. We propose a novel framework, the Object-Concept-Relation Triad (OCRT), that enables FMs to extract sparse, high-level concepts and intricate relational structures from raw visual inputs. The key idea is to bind objects in visual scenes and a set of object-centric representations through unsupervised decoupling and iterative refinement. To be specific, we project the object-centric representations onto a semantic concept space that the model can readily interpret and estimate their importance to filter out irrelevant elements. Then, a concept-based graph, which has a flexible degree, is constructed to incorporate the set of concepts and their corresponding importance, enabling the extraction of high-order factors from informative concepts and facilitating relational reasoning among these concepts. Extensive experiments demonstrate that OCRT can substantially boost the generalizability and robustness of SAM and CLIP across multiple downstream tasks.",March 2025.,https://arxiv.org/abs/2503.18695,
132,Predicting the Road Ahead: A Knowledge Graph based Foundation Model for Scene Understanding in Autonomous Driving,"Hongkuan Zhou,Stefan Schmid,Yicong Li,Lavdim Halilaj,Xiangtong Yao,Wei cao","The autonomous driving field has seen remarkable advancements in various topics, such as object recognition, trajectory prediction, and motion planning. However, current approaches face limitations in effectively comprehending the complex evolutions of driving scenes over time. This paper proposes FM4SU, a novel methodology for training a symbolic foundation model (FM) for scene understanding in autonomous driving. It leverages knowledge graphs (KGs) to capture sensory observation along with domain knowledge such as road topology, traffic rules, or complex interactions between traffic participants. A bird's eye view (BEV) symbolic representation is extracted from the KG for each driving scene, including the spatio-temporal information among the objects across the scenes. The BEV representation is serialized into a sequence of tokens and given to pre-trained language models (PLMs) for learning an inherent understanding of the co-occurrence among driving scene elements and generating predictions on the next scenes. We conducted a number of experiments using the nuScenes dataset and KG in various scenarios. The results demonstrate that fine-tuned models achieve significantly higher accuracy in all tasks. The fine-tuned T5 model achieved a next scene prediction accuracy of 86.7%. This paper concludes that FM4SU offers a promising foundation for developing more comprehensive models for scene understanding in autonomous driving.",March 2025.,https://arxiv.org/abs/2503.18730,
133,Interleaved Scene Graphs for Interleaved Text-and-Image Generation Assessment,"Dongping Chen,Ruoxi Chen,Shu Pu,Zhaoyi Liu,Yanru Wu,Caixi Chen,Benlin Liu,Yue Huang,Yao Wan,Pan Zhou,Ranjay Krishna","Many real-world user queries (e.g. ""How do to make egg fried rice?"") could benefit from systems capable of generating responses with both textual steps with accompanying images, similar to a cookbook. Models designed to generate interleaved text and images face challenges in ensuring consistency within and across these modalities. To address these challenges, we present ISG, a comprehensive evaluation framework for interleaved text-and-image generation. ISG leverages a scene graph structure to capture relationships between text and image blocks, evaluating responses on four levels of granularity: holistic, structural, block-level, and image-specific. This multi-tiered evaluation allows for a nuanced assessment of consistency, coherence, and accuracy, and provides interpretable question-answer feedback. In conjunction with ISG, we introduce a benchmark, ISG-Bench, encompassing 1,150 samples across 8 categories and 21 subcategories. This benchmark dataset includes complex language-vision dependencies and golden answers to evaluate models effectively on vision-centric tasks such as style transfer, a challenging area for current models. Using ISG-Bench, we demonstrate that recent unified vision-language models perform poorly on generating interleaved content. While compositional approaches that combine separate language and image models show a 111% improvement over unified models at the holistic level, their performance remains suboptimal at both block and image levels. To facilitate future work, we develop ISG-Agent, a baseline agent employing a ""plan-execute-refine"" pipeline to invoke tools, achieving a 122% performance improvement.",November 2024.,https://arxiv.org/abs/2411.17188,
134,Open-Vocabulary Functional 3D Scene Graphs for Real-World Indoor Spaces,"Chenyangguang Zhang,Alexandros Delitzas,Fangjinhua Wang,Ruida Zhang,Xiangyang Ji,Marc Pollefeys,Francis Engelmann","We introduce the task of predicting functional 3D scene graphs for real-world indoor environments from posed RGB-D images. Unlike traditional 3D scene graphs that focus on spatial relationships of objects, functional 3D scene graphs capture objects, interactive elements, and their functional relationships. Due to the lack of training data, we leverage foundation models, including visual language models (VLMs) and large language models (LLMs), to encode functional knowledge. We evaluate our approach on an extended SceneFun3D dataset and a newly collected dataset, FunGraph3D, both annotated with functional 3D scene graphs. Our method significantly outperforms adapted baselines, including Open3DSG and ConceptGraph, demonstrating its effectiveness in modeling complex scene functionalities. We also demonstrate downstream applications such as 3D question answering and robotic manipulation using functional 3D scene graphs. See our project page at https://openfungraph.github.io",March 2025.,https://arxiv.org/abs/2503.19199,
135,Meta-Objects: Interactive and Multisensory Virtual Objects Learned from the Real World for Use in Augmented Reality,"Dooyoung Kim,Taewook Ha,Jinseok Hong,Seonji Kim,Selin Choi,Heejeong Ko,Woontack Woo","We introduce the concept of a meta-object, a next-generation virtual object that inherits the form, properties, and functions of its real-world counterpart, enabling seamless synchronization, interaction, and sharing between the physical and virtual worlds. While plenty of today's virtual objects provide some sensory feedback and dynamic behavior, meta-objects fully integrate interactive and multisensory features within a structured data framework to enable real-time immersive experiences in a post-metaverse intelligent simulation platform. Three key components underpin the utilization of meta-objects in the post-metaverse: property-embedded modeling for physical and action realism, adaptive multisensory feedback tailored to user interactions, and a scene graph-based intelligence simulation platform for scalable and efficient ecosystem integration. By leveraging meta-objects through wearable AR/VR devices, the post-metaverse facilitates seamless interactions that transcend spatial and temporal barriers, paving the way for a transformative reality-virtuality convergence.",April 2024.,https://arxiv.org/abs/2404.17179,
136,Context-Aware Semantic Segmentation: Enhancing Pixel-Level Understanding with Large Language Models for Advanced Vision Applications,Ben Rahman,"Semantic segmentation has made significant strides in pixel-level image understanding, yet it remains limited in capturing contextual and semantic relationships between objects. Current models, such as CNN and Transformer-based architectures, excel at identifying pixel-level features but fail to distinguish semantically similar objects (e.g., ""doctor"" vs. ""nurse"" in a hospital scene) or understand complex contextual scenarios (e.g., differentiating a running child from a regular pedestrian in autonomous driving). To address these limitations, we proposed a novel Context-Aware Semantic Segmentation framework that integrates Large Language Models (LLMs) with state-of-the-art vision backbones. Our hybrid model leverages the Swin Transformer for robust visual feature extraction and GPT-4 for enriching semantic understanding through text embeddings. A Cross-Attention Mechanism is introduced to align vision and language features, enabling the model to reason about context more effectively. Additionally, Graph Neural Networks (GNNs) are employed to model object relationships within the scene, capturing dependencies that are overlooked by traditional models. Experimental results on benchmark datasets (e.g., COCO, Cityscapes) demonstrate that our approach outperforms the existing methods in both pixel-level accuracy (mIoU) and contextual understanding (mAP). This work bridges the gap between vision and language, paving the path for more intelligent and context-aware vision systems in applications including autonomous driving, medical imaging, and robotics.",March 2025.,https://arxiv.org/abs/2503.19276,
137,Towards Unbiased and Robust Spatio-Temporal Scene Graph Generation and Anticipation,"Rohith Peddi, Saurabh,Ayush Abhay Shrivastava,Parag Singla,Vibhav Gogate","Spatio-Temporal Scene Graphs (STSGs) provide a concise and expressive representation of dynamic scenes by modeling objects and their evolving relationships over time. However, real-world visual relationships often exhibit a long-tailed distribution, causing existing methods for tasks like Video Scene Graph Generation (VidSGG) and Scene Graph Anticipation (SGA) to produce biased scene graphs. To this end, we propose ImparTail, a novel training framework that leverages loss masking and curriculum learning to mitigate bias in the generation and anticipation of spatio-temporal scene graphs. Unlike prior methods that add extra architectural components to learn unbiased estimators, we propose an impartial training objective that reduces the dominance of head classes during learning and focuses on underrepresented tail relationships. Our curriculum-driven mask generation strategy further empowers the model to adaptively adjust its bias mitigation strategy over time, enabling more balanced and robust estimations. To thoroughly assess performance under various distribution shifts, we also introduce two new tasks Robust Spatio-Temporal Scene Graph Generation and Robust Scene Graph Anticipation offering a challenging benchmark for evaluating the resilience of STSG models. Extensive experiments on the Action Genome dataset demonstrate the superior unbiased performance and robustness of our method compared to existing baselines.",November 2024.,https://arxiv.org/abs/2411.13059,
138,RelationField: Relate Anything in Radiance Fields,"Sebastian Koch,Johanna Wald,Mirco Colosi,Narunas Vaskevicius,Pedro Hermosilla,Federico Tombari,Timo Ropinski","Neural radiance fields are an emerging 3D scene representation and recently even been extended to learn features for scene understanding by distilling open-vocabulary features from vision-language models. However, current method primarily focus on object-centric representations, supporting object segmentation or detection, while understanding semantic relationships between objects remains largely unexplored. To address this gap, we propose RelationField, the first method to extract inter-object relationships directly from neural radiance fields. RelationField represents relationships between objects as pairs of rays within a neural radiance field, effectively extending its formulation to include implicit relationship queries. To teach RelationField complex, open-vocabulary relationships, relationship knowledge is distilled from multi-modal LLMs. To evaluate RelationField, we solve open-vocabulary 3D scene graph generation tasks and relationship-guided instance segmentation, achieving state-of-the-art performance in both tasks. See the project website at https://relationfield.github.io.",December 2024.,https://arxiv.org/abs/2412.13652,
139,DynOPETs: A Versatile Benchmark for Dynamic Object Pose Estimation and Tracking in Moving Camera Scenarios,"Xiangting Meng,Jiaqi Yang,Mingshu Chen,Chenxin Yan,Yujiao Shi,Wenchao Ding,Laurent Kneip","In the realm of object pose estimation, scenarios involving both dynamic objects and moving cameras are prevalent. However, the scarcity of corresponding real-world datasets significantly hinders the development and evaluation of robust pose estimation models. This is largely attributed to the inherent challenges in accurately annotating object poses in dynamic scenes captured by moving cameras. To bridge this gap, this paper presents a novel dataset DynOPETs and a dedicated data acquisition and annotation pipeline tailored for object pose estimation and tracking in such unconstrained environments. Our efficient annotation method innovatively integrates pose estimation and pose tracking techniques to generate pseudo-labels, which are subsequently refined through pose graph optimization. The resulting dataset offers accurate pose annotations for dynamic objects observed from moving cameras. To validate the effectiveness and value of our dataset, we perform comprehensive evaluations using 18 state-of-the-art methods, demonstrating its potential to accelerate research in this challenging domain. The dataset will be made publicly available to facilitate further exploration and advancement in the field.",March 2025.,https://arxiv.org/abs/2503.19625,
140,Benchmarking Large Vision-Language Models via Directed Scene Graph for Comprehensive Image Captioning,"Fan Lu,Wei Wu,Kecheng Zheng,Shuailei Ma,Biao Gong,Jiawei Liu,Wei Zhai,Yang Cao,Yujun Shen,Zheng-Jun Zha","Generating detailed captions comprehending text-rich visual content in images has received growing attention for Large Vision-Language Models (LVLMs). However, few studies have developed benchmarks specifically tailored for detailed captions to measure their accuracy and comprehensiveness. In this paper, we introduce a detailed caption benchmark, termed as CompreCap, to evaluate the visual context from a directed scene graph view. Concretely, we first manually segment the image into semantically meaningful regions (i.e., semantic segmentation mask) according to common-object vocabulary, while also distinguishing attributes of objects within all those regions. Then directional relation labels of these objects are annotated to compose a directed scene graph that can well encode rich compositional information of the image. Based on our directed scene graph, we develop a pipeline to assess the generated detailed captions from LVLMs on multiple levels, including the object-level coverage, the accuracy of attribute descriptions, the score of key relationships, etc. Experimental results on the CompreCap dataset confirm that our evaluation method aligns closely with human evaluation scores across LVLMs.",December 2024.,https://arxiv.org/abs/2412.08614,
141,MMGDreamer: Mixed-Modality Graph for Geometry-Controllable 3D Indoor Scene Generation,"Zhifei Yang,Keyang Lu,Chao Zhang,Jiaxing Qi,Hanqi Jiang,Ruifei Ma,Shenglin Yin,Yifan Xu,Mingzhe Xing,Zhen Xiao,Jieyi Long,Guangyao Zhai","Controllable 3D scene generation has extensive applications in virtual reality and interior design, where the generated scenes should exhibit high levels of realism and controllability in terms of geometry. Scene graphs provide a suitable data representation that facilitates these applications. However, current graph-based methods for scene generation are constrained to text-based inputs and exhibit insufficient adaptability to flexible user inputs, hindering the ability to precisely control object geometry. To address this issue, we propose MMGDreamer, a dual-branch diffusion model for scene generation that incorporates a novel Mixed-Modality Graph, visual enhancement module, and relation predictor. The mixed-modality graph allows object nodes to integrate textual and visual modalities, with optional relationships between nodes. It enhances adaptability to flexible user inputs and enables meticulous control over the geometry of objects in the generated scenes. The visual enhancement module enriches the visual fidelity of text-only nodes by constructing visual representations using text embeddings. Furthermore, our relation predictor leverages node representations to infer absent relationships between nodes, resulting in more coherent scene layouts. Extensive experimental results demonstrate that MMGDreamer exhibits superior control of object geometry, achieving state-of-the-art scene generation performance. Project page: https://yangzhifeio.github.io/project/MMGDreamer.",February 2025.,https://arxiv.org/abs/2502.05874,
142,MCBLT: Multi-Camera Multi-Object 3D Tracking in Long Videos,"Yizhou Wang,Tim Meinhardt,Orcun Cetintas,Cheng-Yen Yang,Sameer Satish Pusegaonkar,Benjamin Missaoui,Sujit Biswas,Zheng Tang,Laura Leal-Taix\xc3\xa9","Object perception from multi-view cameras is crucial for intelligent systems, particularly in indoor environments, e.g., warehouses, retail stores, and hospitals. Most traditional multi-target multi-camera (MTMC) detection and tracking methods rely on 2D object detection, single-view multi-object tracking (MOT), and cross-view re-identification (ReID) techniques, without properly handling important 3D information by multi-view image aggregation. In this paper, we propose a 3D object detection and tracking framework, named MCBLT, which first aggregates multi-view images with necessary camera calibration parameters to obtain 3D object detections in bird's-eye view (BEV). Then, we introduce hierarchical graph neural networks (GNNs) to track these 3D detections in BEV for MTMC tracking results. Unlike existing methods, MCBLT has impressive generalizability across different scenes and diverse camera settings, with exceptional capability for long-term association handling. As a result, our proposed MCBLT establishes a new state-of-the-art on the AICity'24 dataset with $81.22$ HOTA, and on the WildTrack dataset with $95.6$ IDF1.",December 2024.,https://arxiv.org/abs/2412.00692,
143,MESA: Effective Matching Redundancy Reduction by Semantic Area Segmentation,"Yesheng Zhang,Shuhan Shen,Xu Zhao","We propose MESA and DMESA as novel feature matching methods, which utilize Segment Anything Model (SAM) to effectively mitigate matching redundancy. The key insight of our methods is to establish implicit-semantic area matching prior to point matching, based on advanced image understanding of SAM. Then, informative area matches with consistent internal semantic are able to undergo dense feature comparison, facilitating precise inside-area point matching. Specifically, MESA adopts a sparse matching framework and first obtains candidate areas from SAM results through a novel Area Graph (AG). Then, area matching among the candidates is formulated as graph energy minimization and solved by graphical models derived from AG. To address the efficiency issue of MESA, we further propose DMESA as its dense counterpart, applying a dense matching framework. After candidate areas are identified by AG, DMESA establishes area matches through generating dense matching distributions. The distributions are produced from off-the-shelf patch matching utilizing the Gaussian Mixture Model and refined via the Expectation Maximization. With less repetitive computation, DMESA showcases a speed improvement of nearly five times compared to MESA, while maintaining competitive accuracy. Our methods are extensively evaluated on five datasets encompassing indoor and outdoor scenes. The results illustrate consistent performance improvements from our methods for five distinct point matching baselines across all datasets. Furthermore, our methods exhibit promise generalization and improved robustness against image resolution variations. The code is publicly available at https://github.com/Easonyesheng/A2PM-MESA.",August 2024.,https://arxiv.org/abs/2408.00279,
